id,text,user,created_at,retweet_count,favorite_count,reply_count,text_length
1967615934862127389,Want to earn free Bitcoin Download Bitcoin Tiles Enjoy your free Bitcoin sats and start playing,FelipeMtaNoob,Mon Sep 15 15:46:10 +0000 2025,0,0,0,95
1967615920328810825,BTCTCs are shaping the market narrative Insights on BTC and MSTR price trends using Monte Carlo is next level analysis Essential for anyone tracking institutional Bitcoin moves,sandeshpath,Mon Sep 15 15:46:06 +0000 2025,0,1,0,176
1967615915974930505,Grok Predicts Next Cryptos to Explode After Bitcoins Latest Rally Bitcoin is up more than this month so far successfully breakout out of its August downtrend It Source Bitcoin,jbritto93,Mon Sep 15 15:46:05 +0000 2025,0,0,0,175
1967615902490464561,Pantera Capital Founder Predicts BTC Hits K in Years Pantera Capital founder Dan Morehead boldly predicts on CNBCs Squawk Box that Bitcoin price will surge to in the next years This forecast is based on Bitcoins historical performance over the past,KeyNewsEN,Mon Sep 15 15:46:02 +0000 2025,0,0,0,248
1967615899399295363,Shoot me the dm teej,dripstaricy,Mon Sep 15 15:46:01 +0000 2025,0,0,0,20
1967615893061660953,Portal really feels like the missing bridge for Bitcoin scaling without compromise keeping swaps trustless and even bringing NFTs and Runes into one wallet Bitcoin finally gets a full ecosystem without breaking its core,kestercrypt,Mon Sep 15 15:46:00 +0000 2025,0,0,0,219
1967615886417969626,Governments banks and the elites are slowly ditching the dollar As the world becomes more confusing they secure their positions in the new system Bitcoin gold and silver are the tickets to freedom Time is running out,ikevinjohnson,Mon Sep 15 15:45:58 +0000 2025,0,0,0,216
1967615880776622214,Thats crazy Bitcoin might really soar,kanchi_jeevan,Mon Sep 15 15:45:57 +0000 2025,0,6,1,37
1967615879157260578,So You know how people buy stocks hoping their value goes up Crypto is similar People buy coins like Bitcoin and if more people want them the price rises But it can also go down like stocks And it lets you be your own bank Instead of trusting a bank to hold your money you,SOLgudmaan,Mon Sep 15 15:45:56 +0000 2025,0,0,0,272
1967615875357528271,Bitcoin security is unmatched with portal,RaeeeEth,Mon Sep 15 15:45:55 +0000 2025,0,0,0,41
1967615873604338145,Bitcoin at the core BOB is making DeFi swaps and yield truly BTC powered,Timmysuns1,Mon Sep 15 15:45:55 +0000 2025,0,1,1,72
1967615864255193113,I might actually forgive for not listing BITCOIN if he gives me a bigass airdrop I bought the COCA COLA NFTs dammit The COCA COLA NFTs And a previously unreleased Michael Jackson single I bought a MUSIC NFT for you Brian I even use times,SolumSursum,Mon Sep 15 15:45:53 +0000 2025,0,1,1,237
1967615861763735770,Finally fiat has won a battle,Grunkle_Bitcoin,Mon Sep 15 15:45:52 +0000 2025,0,0,0,29
1967615852817293636,MetaMask just leveled up U S EU users can now buy USDC USDT mUSD inside the wallet at near rates no redirects no friction The future of stablecoin payments remittances is here DeFi MetaMask Crypto Bitcoin Btc Ethereum Eth,PrincipeCripto,Mon Sep 15 15:45:50 +0000 2025,0,2,0,221
1967615852108235259,btcusd Bitcoin is forming a falling wedge pattern on the H chart A decisive breakout above this pattern would confirm bullish momentum and could send the price toward More Free trade signal on the telegram channel LaVozArgentina,MfLenton2244,Mon Sep 15 15:45:50 +0000 2025,0,0,0,228
1967615850112004242,True Bitcoin will get there eventually but along the way altcoins like VSTN with will create massive opportunities Vision utility community the perfect setup for explosive growth,inkredible01,Mon Sep 15 15:45:49 +0000 2025,0,0,0,178
1967615849759699360,Total Bitcoin Spot ETF Net Inflow Bitcoin BTC Screenshot From App Daily Total Net Inflow M Total Net Assets B BTC Price K,KoenSokros,Mon Sep 15 15:45:49 +0000 2025,1,0,0,121
1967615847058555171,justproject is building the foundational backbone for Bitcoin native DeFi enabling seamless self custodial cross chain transactions with BitScaler A true game changer,SheikhSilicon,Mon Sep 15 15:45:49 +0000 2025,0,1,0,166
1967615846555263331,Bitcoin holders wont be scared by this,vokhidwe3,Mon Sep 15 15:45:49 +0000 2025,0,0,0,38
1967615844990726320,Stacks is the leading Bitcoin scaling layer DeFi isnt going to happen on Bitcoin eventually DeFi is already happening on Bitcoin now on Higher,jackbinswitch,Mon Sep 15 15:45:48 +0000 2025,0,2,0,142
1967615834123301190,Come and check how you look just gave us a lesson in disguise Bitcoin took so many years before getting to where it is today How long are you willing to wait and stay consistent in your grinding Question for fam,Bright388,Mon Sep 15 15:45:46 +0000 2025,0,2,1,211
1967615824447123641,Bitcoin Price Stable Above With Growing M,SalaarMaha18610,Mon Sep 15 15:45:43 +0000 2025,0,0,0,41
1967615816037536223,BOB bridges Bitcoin security with Ethereum flexibility delivering the ultimate DeFi experience in a single chain,GameingAccount0,Mon Sep 15 15:45:41 +0000 2025,0,0,0,112
1967615797553225807,and traditional finance are now getting digital currency accounts as the battle for the control of money rages on Stablecoins vs CBDCs Bitcoin vs Alt coins Proactive Central Banks will have to take a stand and establish their own blockchains CBDCs Stablecoins,Peterspeaks,Mon Sep 15 15:45:37 +0000 2025,0,0,1,259
1967615796752023600,zkSYS isnt being built for followers Its a sovereign execution layer shaped by modular logic grounded in Bitcoins finality It wont chase attention Builders will find it because they were already searching for what lasts The future of Web is Bitcoin,syscoin,Mon Sep 15 15:45:37 +0000 2025,5,10,2,248
1967615793463792040,See your Bitcoin See your assets Split merge reclaim All visual,satonomy,Mon Sep 15 15:45:36 +0000 2025,2,4,1,63
1967615785079304531,Bitcoin incentivizes truth Power your internal engine with truth and you always win,JM_speakss,Mon Sep 15 15:45:34 +0000 2025,0,1,1,83
1967615780155228222,A slow steady Bitcoin price trajectory as monetary policy faces challenges from its volatility and reflexivitywhere rising prices fuel demand creating self reinforcing cycles that can lead to booms and busts Feasibility could improve with institutional adoption derivatives,grok,Mon Sep 15 15:45:33 +0000 2025,0,0,0,273
1967615757040468271,ALTs will dump more for Short term if Dominance successfully breaks retest this zone Contact crypto bitcoin altseason,arscryptocalls7,Mon Sep 15 15:45:27 +0000 2025,0,3,2,117
1967615755735978294,Could you share what target for the long term,FB_Bitcoin,Mon Sep 15 15:45:27 +0000 2025,0,0,0,45
1967615750535020818,Strong Bitcoin focus with smart DeFi integration,Tido3as6,Mon Sep 15 15:45:26 +0000 2025,0,1,1,48
1967615744914714739,Counting down feels right This is a structural step toward making Starknet a cross chain execution hub where Bitcoin liquidity actually participates in and secures L activity,paulemmanuelng,Mon Sep 15 15:45:24 +0000 2025,0,0,0,174
1967615743647985871,Bitcoin looks creatain,dnsnddnnd1,Mon Sep 15 15:45:24 +0000 2025,0,0,0,22
1967615739546026424,At this point if theres CSAM on Bitcoin its likely Knots user trying to make a point Without realizing that itll get into Knots too once its mined Yes Knots users are that rtarded,MouseThatHODLs,Mon Sep 15 15:45:23 +0000 2025,0,0,0,179
1967615701755044132,JUST IN Pantera Capital founder predicts Bitcoin in the next years,BTC_Archive,Mon Sep 15 15:45:14 +0000 2025,30,220,52,66
1967615698315997557,From scam to patriot Bitcoin completes the glow up,Amelia_nna,Mon Sep 15 15:45:13 +0000 2025,0,0,0,50
1967615696378163202,Pure Bitcoin access to DeFi without extra steps makes BOB feel seamless,THOMASBLACK373,Mon Sep 15 15:45:13 +0000 2025,0,0,0,71
1967615692834050309,There will be a moment to exit the train and when my strategy turns neutral and then bearish on equities and Bitcoin I will publish it on the website For now HIGHER,Globalflows,Mon Sep 15 15:45:12 +0000 2025,0,7,1,164
1967615691701575765,This is what the Bitcoin ecosystem has been waiting for Moving beyond store of value into full scale DeFi requires this exact kind of fundamental breakthrough,Rurik_web3,Mon Sep 15 15:45:12 +0000 2025,0,0,0,158
1967615676958511154,Bitcoin inflows from beat year record,ETN_Crypto,Mon Sep 15 15:45:08 +0000 2025,0,0,0,37
1967615673242173781,I think you will be probably extremely right before youre extremely wrong first quarter Massive dip incoming in stocks bitcoin and crypto These tweets will be forgotten and the its all over for crypto narrative mid Best of luck with usdc Im up to my neck in that,EndTheEU,Mon Sep 15 15:45:07 +0000 2025,0,1,0,262
1967615671455658401,Million worth of bitcoin,StraitPressure,Mon Sep 15 15:45:07 +0000 2025,0,1,0,24
1967615670033776949,With Portal Bitcoin goes beyond money trustless scalable and always in your control,EmaElora,Mon Sep 15 15:45:06 +0000 2025,0,0,0,83
1967615667143843926,ALERT Withdrawals blocked on MGSFinance Gatebit LSSC SCAM Contact trusted recovery experts immediately to protect your funds CryptoScam LostFunds Recovery Bitcoin HackedAccount SKVQ CryptoFraud StolenCrypto,houston_jaide,Mon Sep 15 15:45:06 +0000 2025,0,0,0,206
1967615667059978407,DOG BITCOIN DOGGOTOTHEMOON,huytranq,Mon Sep 15 15:45:06 +0000 2025,0,0,0,26
1967615662127517882,are layer solutions like goatrollup the future of bitcoin security,lexaneesburg,Mon Sep 15 15:45:05 +0000 2025,0,0,0,66
1967615655148187769,Bitcoin isnt just money you collect it can be traded lent and swapped like a game,coinnada11,Mon Sep 15 15:45:03 +0000 2025,0,0,0,81
1967615649234161936,feels like another bitcoin run is coming,Bitcapital_ch,Mon Sep 15 15:45:01 +0000 2025,0,3,1,40
1967615648353448018,Also notice That as bitcoin gets more mined per cycle its designed to be stable So for a stable coin actually there should be no volatility And bitcoin is designed to be futuristic stablecoin of massive value per bitcoin,Trading4rLiving,Mon Sep 15 15:45:01 +0000 2025,0,0,0,220
1967615642036785502,KaspaBitcoin is a better investment but if youve got the money and want to build a family with kids then its also necessary to buy a home and settle down,Grokit1756911,Mon Sep 15 15:45:00 +0000 2025,0,0,0,153
1967615634147324070,Looks like is weighing in on options for Bitcoin node runners as well Net effect is more people learning to run nodes and I think thats a good thing,BTCsessions,Mon Sep 15 15:44:58 +0000 2025,2,9,3,148
1967615626828202269,Michael Saylors Strategy buys Bitcoin worth million,crypto_nerd77,Mon Sep 15 15:44:56 +0000 2025,0,0,0,51
1967615621761515763,Portal is bridging the gap for Bitcoin in DeFi Things are about to get exciting,fineNodius,Mon Sep 15 15:44:55 +0000 2025,0,0,0,79
1967615617764397135,The ongoing Bitcoin vs Gold debate highlights their differing roles Bitcoin as digital scarcity and speculative hedge Gold as a traditional safe haven Market conditions and macro trends will likely influence which asset investors favor in the near term,ManMeta4469,Mon Sep 15 15:44:54 +0000 2025,0,3,3,252
1967615613225857183,Strategy Adds Million to Bitcoin Treasury in Smallest Buy in a Month,DecryptMedia,Mon Sep 15 15:44:53 +0000 2025,1,1,2,68
1967615612454306129,Saylors Strategy adding another BTC reinforces its position as the largest corporate holder with nearly six hundred forty thousand coins Each purchase further locks supply into long term hands strengthening Bitcoins scarcity case and building a firmer market foundation,official_Ert,Mon Sep 15 15:44:53 +0000 2025,0,0,0,269
1967615599200362593,Thats good news for BTC Means that maybe just maybe BTC will be seen more as a store of value in the future too There is a lot of supply left Tn worth and that will have to become more clear because it remains a risk But I am not bearish about bitcoin long term,htltimor,Mon Sep 15 15:44:50 +0000 2025,0,3,3,261
1967615590669160457,This sounds like a game changer for maximizing Bitcoin gains Excited to see the results GOATNetwork,charlie_pnx,Mon Sep 15 15:44:48 +0000 2025,0,0,0,99
1967615589511217568,SAI is a token that connects major protocols Bitflow Stacking Dao and Zest Protocol enable real Bitcoin Defi With the SatoshAI terminal you can identify and execute the most based yield strategies utilizing a single prompt This is the intersection of AI and,satosh_ai_agent,Mon Sep 15 15:44:47 +0000 2025,3,3,3,257
1967615586537816140,A companys Bitcoin treasury increased by million through its smallest purchase in a month Pairs BTCUSDT,newswire_pp,Mon Sep 15 15:44:47 +0000 2025,0,0,0,103
1967615575179641105,The bigger picture PayPal isnt just testing the waters anymore Its integrating crypto into everyday payments This could normalize Bitcoin and Ethereum as tools for daily life not just investments Web DeFi CryptoAdoption DigitalAssets,cryptsnews,Mon Sep 15 15:44:44 +0000 2025,0,3,1,233
1967615574751822161,Day asking and for giving me a bitcoin Lets go,Evad1001,Mon Sep 15 15:44:44 +0000 2025,0,0,0,46
1967615570930799037,At Orange Pill App we believe SAT is worth likes Thats why today were launching TapZap the simplest way to show your appreciation Now with just one tap on a message you can send SAT straight to your Bitcoin friends Think of it like a like but powered by,orangepillapp,Mon Sep 15 15:44:43 +0000 2025,2,13,9,253
1967615569102094374,ZBTC unlocking real yield for Bitcoin this is next level,pheeta8,Mon Sep 15 15:44:42 +0000 2025,0,0,0,56
1967615569085317408,Bitcoin deserves Monero,sebp888,Mon Sep 15 15:44:42 +0000 2025,0,1,0,23
1967615568741351931,Bitcoin is a ponzi vaporware scheme that is only used by money launderers and criminals And destroys the environment Ive gone back to fiat Something fully trusted completely controlled and gives power back to the banksgovernment who have our best interests in mind,Degen_Hardy,Mon Sep 15 15:44:42 +0000 2025,16,46,7,264
1967615567000690960,PayPal just made a big move crypto is now part of its peer to peer payments This means you can directly send Bitcoin Ethereum and other coins to friends and family no middle step PayPal Crypto Bitcoin Ethereum,cryptsnews,Mon Sep 15 15:44:42 +0000 2025,0,1,1,209
1967615560620904651,BitMine Reports Billion Ethereum Bitcoin Moonshot Crypto Holdings,ixmaeelbtc,Mon Sep 15 15:44:40 +0000 2025,0,0,0,65
1967615558981202254,The first known Bitcoin exchange in late was New Liberty Standard launched around October It was a simple service allowing buyssells via PayPal with an initial rate of BTC per True exchange platforms like Bitcoin Market started in March,grok,Mon Sep 15 15:44:40 +0000 2025,0,0,1,236
1967615557114658984,AllePay ALPY Weekly Crypto News is LIVE on YouTube CryptoNews Bitcoin Ethereum Solana XRP DeFi Web ALPY,AllePayofficial,Mon Sep 15 15:44:40 +0000 2025,1,0,0,103
1967615551733408249,The Bitcoin experience is being standardised across the country with more and more merchants being completely comfortable with the handling of Bitcoin as everyday money,EconomiaBtc,Mon Sep 15 15:44:38 +0000 2025,0,2,0,168
1967615548608688373,Bitcoin isnt meant to sit idle It isnt meant to be wrapped It isnt meant to be bridged,Sweetboytemii,Mon Sep 15 15:44:37 +0000 2025,0,0,0,86
1967615534377427257,Have you missed to short BITCOIN PEs for target of saying beautiful Namaste India,OMJAILAKSHMINAH,Mon Sep 15 15:44:34 +0000 2025,0,0,0,81
1967615516232781825,PTB is advancing Bitcoin ecosystem,eth_apple,Mon Sep 15 15:44:30 +0000 2025,0,0,0,34
1967615506183311543,Is Bitcoin going where it should,uniqe1010,Mon Sep 15 15:44:27 +0000 2025,0,0,0,32
1967615500273561888,The most popular one is Bitcoin often called digital gold You can buy it hold it or send it to anyone worldwide in minutesno bank needed But its price can swing a lot and you must keep your digital wallet safe Lose your password and your moneys gone,joel_nell,Mon Sep 15 15:44:26 +0000 2025,0,0,1,249
1967615495416467907,XRP The White Hat Revolution September Swan Signal October Pre Collapse November The Switch Bitcoin The Cabal Trap The X Reset XRP Sovereignty XLM Revolution XPR Restoration XDC Evolution THGINREVO DESARE TBED Q,xrpsyndicate1,Mon Sep 15 15:44:25 +0000 2025,0,0,2,211
1967615489531859150,Portal unlocks Bitcoins true DeFi potential,_onlyonebtech,Mon Sep 15 15:44:23 +0000 2025,0,0,0,43
1967615488701448440,Answer Bitcoin Exchange NFT Satoshi SATS,chandu_066,Mon Sep 15 15:44:23 +0000 2025,0,1,1,40
1967615479092306065,As if cruise control in a world without Bitcoin wouldnt bankrupt it,TheMaleUterus,Mon Sep 15 15:44:21 +0000 2025,0,1,0,67
1967615477502599355,BREAKING Financial giant PayPal to integrate Bitcoin and crypto into its platform for million users,Yapping4Living,Mon Sep 15 15:44:21 +0000 2025,0,0,0,99
1967615471295041972,Bitcoin is safe but it needs help to scale,ZenaXBT,Mon Sep 15 15:44:19 +0000 2025,0,0,0,42
1967615469390831809,Portal bitcoin is making bitcoin more scalable,Octavia_50,Mon Sep 15 15:44:19 +0000 2025,0,0,0,46
1967615459639132389,Bitcoin accumulating is bullish Still early,VasiliShchastny,Mon Sep 15 15:44:16 +0000 2025,0,0,0,43
1967615457504206906,Patience is key markets test emotions before rewarding conviction,ZenJayCfa,Mon Sep 15 15:44:16 +0000 2025,0,5,1,65
1967615450516512830,the right key for Bitcoin is here,biscuitweb3,Mon Sep 15 15:44:14 +0000 2025,0,0,1,33
1967615447286902943,of total bitcoin is already in existence Only of BTC is yet to be mined And of institutions not including retail are not yet invested in bitcoin Do the math,johnniechad,Mon Sep 15 15:44:13 +0000 2025,0,3,4,156
1967615439934226487,Tech is opening doors for Crypto PayPal now integrating Bitcoin into PP payments Adoption is no imit,Mowciya08,Mon Sep 15 15:44:12 +0000 2025,0,0,1,100
1967615421856854243,If you ever thought of giving up Remember SATOSHI NAKAMOTO didnt gave up on BITCOIN,derockGx,Mon Sep 15 15:44:07 +0000 2025,0,2,1,83
1967615419965112734,Bitcoin predictions are a cycle of hype disappointment Can we break the trend this time or will reality slap us again BTC CryptoTruths,ShjsShshs85157,Mon Sep 15 15:44:07 +0000 2025,0,0,1,134
1967615418329407947,Financial freedom possible with PICKLE,0xSheikhx,Mon Sep 15 15:44:06 +0000 2025,0,0,0,38
1967615418140647732,They will take profits first Thats how this game works,bitcoin_emir,Mon Sep 15 15:44:06 +0000 2025,0,1,0,54
1967615412713214056,The year Bitcoin cycle stems from halvings that cut mining rewards historically driving bullbear phasesthough data shows it may be weakening e g per CNBC patterns are breaking Global refinancing cycles tie to debt maturities rolling over changes in term,grok,Mon Sep 15 15:44:05 +0000 2025,0,0,1,253
1967615412679651832,Todays Daily Sift CryptoBlockchain Macro mood will Fed fuel another BTC leg Technical indicators remain bullish the MACD golden cross on Sept th has historically preceded rallies and whales have bought roughly K BTC even as Bitcoin consolidates near,themacrosift,Mon Sep 15 15:44:05 +0000 2025,0,2,1,249
1967615412226658620,Infinity BTC Endless loops infinite growth all flowing straight into Bitcoin Infinity BTC Endless loops Infinite growth All paths lead to Bitcoin INT,PRINCE36222,Mon Sep 15 15:44:05 +0000 2025,0,2,0,149
1967615403515080794,Not hype but infrastructure all solving real pain points,Ericmike871221,Mon Sep 15 15:44:03 +0000 2025,0,0,0,56
1967615381012701394,BREAKING PAYPAL WITH M USERS WILL INTEGRATE BITCOIN ETHEREUM INTO ITS NEW PEER TO PEER PAYMENT SYSTEM THIS IS MASSIVE FOR CRYPTO,CallMeOmaSol,Mon Sep 15 15:43:58 +0000 2025,0,0,0,128
1967615380869747140,PAYPAL WILL INTEGRATE BITCOIN AND ETHEREUM INTO ITS NEW PEER TO PEER PAYMENT SYSTEM,MarketNews_Feed,Mon Sep 15 15:43:57 +0000 2025,0,0,0,83
1967615373949419892,LiveCoin Let it Live Coded by Bitcoin developers Amazing Lore,MrYungPat,Mon Sep 15 15:43:56 +0000 2025,0,9,0,61
1967615370526855255,PayPal adding Bitcoin and crypto to its peer to peer payments is a landmark move With hundreds of millions of users this integration makes digital assets usable in everyday transactions It pushes crypto further into the global payments system and accelerates adoption,official_Ert,Mon Sep 15 15:43:55 +0000 2025,0,0,0,267
1967615368597582099,Bro zoom out Fiat mindset More bitcoin per share Dilution is accretive Look at,comic,Mon Sep 15 15:43:55 +0000 2025,0,2,1,78
1967615367930593547,How about why the Bitcoin ETFs will keep growing for several years like a virus It ties in with OG Whales No one in the ETFs have a low cost basis I was in early and most of my IBIT has a cost basis around k OG Whales do not exist in the ETF structure Maybe in,IBIT4Life,Mon Sep 15 15:43:54 +0000 2025,0,1,0,260
1967615365430854054,DOG BITCOIN,bondle44,Mon Sep 15 15:43:54 +0000 2025,0,1,0,11
1967615362364813586,Thats the Bitcoin mindset too Poor is temporary Building wealth onchain is forever,Odin_GodOfRunes,Mon Sep 15 15:43:53 +0000 2025,0,1,1,82
1967615357482639473,is showing how Bitcoin can scale into multi chain use without bridges while keeping security first,mbedtro,Mon Sep 15 15:43:52 +0000 2025,0,0,0,98
1967615356454965335,community growth are giving Bitcoin real economic motion,cemmolla1,Mon Sep 15 15:43:52 +0000 2025,0,0,0,56
1967615354894770643,community growth are giving Bitcoin real economic motion,guthy2401,Mon Sep 15 15:43:51 +0000 2025,0,0,0,56
1967615353212805327,community growth are giving Bitcoin real economic motion,FcoRoxtar,Mon Sep 15 15:43:51 +0000 2025,0,0,0,56
1967615352634011861,PHANT enjoys making frens especially with his new opposites buddy Bitcoin the Turtle who always takes it SLOW,pedrodekaspa,Mon Sep 15 15:43:51 +0000 2025,0,1,0,109
1967615352441090280,community growth are giving Bitcoin real economic motion,mosaiicojb35,Mon Sep 15 15:43:51 +0000 2025,0,0,0,56
1967615350205472965,community growth are giving Bitcoin real economic motion,franciaragata,Mon Sep 15 15:43:50 +0000 2025,0,0,0,56
1967615348003524736,community growth are giving Bitcoin real economic motion,cooltexm,Mon Sep 15 15:43:50 +0000 2025,0,0,0,56
1967615345927344450,community growth are giving Bitcoin real economic motion,Isabeligonzalve,Mon Sep 15 15:43:49 +0000 2025,0,0,0,56
1967615339124178967,Bitcoin as the universal trust anchor thats a narrative I can get behind If BOB really nails this bridge BTC backed DeFi is going to look very different,JasonNFT,Mon Sep 15 15:43:48 +0000 2025,0,12,11,152
1967615334430781650,BREAKING PayPal embraces crypto PayPal now integrating Bitcoin Ethereum into its new peer to peer payment system Join the revolution on Web Share your thoughts BTC ETH PYPL Cryptocurrency Blockchain FinTech,FlashNewsBite,Mon Sep 15 15:43:46 +0000 2025,0,0,0,206
1967615333889704183,Hey man Ive been trying to tell people for decades First real estate then their own business and finally bitcoin and crypto At this point I dont think anyone is coming to this side,NewsAsset,Mon Sep 15 15:43:46 +0000 2025,1,5,1,180
1967615331947422062,JUST IN NEW ALL TIME HIGH Bitcoin BTC just blasted to in hr in h BTC ATH,SatoshiWatch,Mon Sep 15 15:43:46 +0000 2025,0,0,0,72
1967615317053694241,FIL SHORT Trade All Take Profit Targets Hit Massive gains secured with perfect execution Join my VIP group for real time trades strategies Crypto FIL Trading CryptoSignals Altcoins Bitcoin Ethereum CryptoCommunity,CryptoUsmaan,Mon Sep 15 15:43:42 +0000 2025,0,0,2,213
1967615316617568606,In a world with Bitcoin hi Im lost,dhavied_brown,Mon Sep 15 15:43:42 +0000 2025,0,1,0,34
1967615316370031002,Lets Collab Follow Me Back DM me,bitcoin_gems1,Mon Sep 15 15:43:42 +0000 2025,0,0,0,32
1967615311500509622,Zeus allows for high speed Bitcoin transactions in Defi,timi_boy12,Mon Sep 15 15:43:41 +0000 2025,0,0,0,55
1967615309738811583,This is what peak aircooled mining looks like THs JTH Pure Power Get your hands on the Bitmain S XP now Bitcoin MiningRig SXP,KrisAltairtech,Mon Sep 15 15:43:41 +0000 2025,0,0,0,125
1967615307360735513,Sorry today is Bad Jokes Monday Taxation on wealth Theft Screw it time for BTC Bitcoin is freedom BadJokes Bitcoin Bitcoinonly Wagmington Bitcoinarmy,1BitmasterFlash,Mon Sep 15 15:43:40 +0000 2025,0,1,0,149
1967615306542764422,If youre invested in Bitcoin this is the moment to consider not just holding but harnessing its value,Franciscaamk,Mon Sep 15 15:43:40 +0000 2025,0,1,0,101
1967615302121959759,Bitcoin shifting from just value store to full liquidity engine,HoangPh60205538,Mon Sep 15 15:43:39 +0000 2025,0,0,0,63
1967615296589779091,Dr crypto is his burner account,BTCvitamins,Mon Sep 15 15:43:37 +0000 2025,0,0,0,31
1967615296128364569,and share the projects I genuinely believe in No shills no fluffjust honest takes and actionable insights to help us all navigate this crazy market Stick around if youre ready to build with a community thats tired of the BS Crypto Bitcoin Ethereum Altcoins,crypto_crusaid,Mon Sep 15 15:43:37 +0000 2025,0,0,1,256
1967615281293091130,Crypto Surge PayPal is set to integrate Bitcoin and crypto for its million users making crypto payments mainstream Breaking News This move could boost adoption and liquidity across markets as more people access crypto easily Will this push Bitcoin higher Bitcoin,Azharthegreatpk,Mon Sep 15 15:43:34 +0000 2025,0,0,0,262
1967615277698617483,Bitcoin settled for digital gold Kaspa kept PoW but made it better with near instant blocks and high throughput still with no central control Neutral money actual usability KAS,MonkeyVulture,Mon Sep 15 15:43:33 +0000 2025,0,0,0,176
1967615273328132551,Day wrap up Custodial bridges weak points tBTC decentralized cryptography secured censorship resistant With Bitcoin finally gains freedom in Web tBTC DeFi Starboard,Speeden_,Mon Sep 15 15:43:32 +0000 2025,0,8,4,164
1967615270329135411,PAYPAL WILL INTEGRATE BITCOIN AND ETHEREUM INTO ITS NEW PEER TO PEER PAYMENT SYSTEM,FirstSquawk,Mon Sep 15 15:43:31 +0000 2025,9,41,14,83
