id,text,user,created_at,retweet_count,favorite_count,reply_count,date,text_length
1963026372177362955,ABOUT TO BE LIKE LUIGI 😂🤪😅 #bitcoin #altcoins #memes What do you think? 📲 Join our Telegram community to closely follow how this story evolves and analyze the repercussions in real time. DONATIONS USDT BEP20 0x78ED05554724d88484a06C6638b2e668F0F81D2d FREE TELEGRAM,Fredvelezcrypto,Tue Sep 02 23:48:53 +0000 2025,1,2,1,2025-09-02,264
1963025856496074859,Already looking forward to 2026's BITCOIN IS FOR EVERYONE 💪❤️ I hope to attend more of these smaller venues where you can connect one-on-one with such great minds. (of course they'll have to have a great host) h/t @BITCOINisforALL/@gauchoeddy,ProofOfMoney,Tue Sep 02 23:46:50 +0000 2025,16,114,21,2025-09-02,242
1963028927581995116,Just found some raw un-mined Bitcoin.,JChainsX,Tue Sep 02 23:59:02 +0000 2025,0,9,0,2025-09-02,37
1963026525001031819,NEW 🚨: The $10M Bitcoin Blind Spot Nobody Talks About 👇,SimplyBitcoinTV,Tue Sep 02 23:49:29 +0000 2025,10,70,6,2025-09-02,55
1963029041226907896,"""Every new custody model creates a creative constraint for businesses."" Dive into Joe Kelly's insights on Bitcoin and innovation as founder of @unchained in the latest episode of Early Days @pleblab . Listen now:",uncleJim21,Tue Sep 02 23:59:29 +0000 2025,0,0,0,2025-09-02,212
1963026485989761428,"Where's my nerds at??? You gotta give it to the Buckazoids community! ... Some real talent here! What a Masterpiece! “A long time ago in a galaxy far, far away…Before Bitcoin... there was Buckazoids ₿"" Shout out to @TimeTravelerExp for building this! Roger wilco... A.K.A...",TrenchSniper69,Tue Sep 02 23:49:20 +0000 2025,39,61,32,2025-09-02,274
1963028948796796977,"""It says ""Bitties"" on her t-shirt sir""",LoveIsBitcoin21,Tue Sep 02 23:59:07 +0000 2025,0,5,0,2025-09-02,38
1963026509611794624,Gotcha 🎯 Powered by #HOSANNA ✝️ #Crypto 🌐 #Bitcoin ₿ #Ethereum 💠 #DeFi 🔗 #Web3 🚀 #Blockchain ⛓️ #DAO 🏛️ #NFT 🎨 #Altcoins 🪙 #X ✖️ #AI 🤖 #BTC 💵 #ETH 🔥 #SOL ☀️ #XRPL 🌊 #HODL 🚀 #CryptoCommunity 👥 #CryptoNews 📰 #Coi #Trump #WhiteHouseNewMedia 😱💡🧐 #OnChain #Currency,HosannaCoin,Tue Sep 02 23:49:25 +0000 2025,0,1,0,2025-09-02,260
1963026468948029558,"🚨NEW VIDEO🚨 Collateral Wars: Bitcoin, Chips, & The Next Dollar System Nik & @kanemcgukin break down why collateral drives liquidity, how chips and stablecoins create new rails, & where Bitcoin fits as digital collateral. Banks, credit, and the dollar’s tech pivot all covered.",TheBitcoinLayer,Tue Sep 02 23:49:16 +0000 2025,4,26,5,2025-09-02,276
1963028506729648331,@AltcoinSherpa Imagine not having exposure to $lolcoin which Mitsubishi Goldstein (aka Satoshi Nakamoto) created in 2011 to promote #Bitcoin #lolcoin is Satoshi Nakamoto’s memecoin trading at a 7.1m mcap. r/r of the century - still not too late…,CryptoScoopOG,Tue Sep 02 23:57:21 +0000 2025,4,10,1,2025-09-02,245
1963027669609529514,"Why do I have exposure to $ETH? Well, I was once against anything else not Bitcoin in the crypto space… But, Tom Lee really opened my eyes to what Wall Street will do with ETH. Bitcoin is immutable money (digital gold)…and will always be the safest and best thing I will ever",ChromeHODLs,Tue Sep 02 23:54:02 +0000 2025,0,1,0,2025-09-02,275
1963027022491357411,Someone who's had a $50 weekly DCA since 2013 would have nearly $7 million saved in bitcoin today. 🤯,w_s_bitcoin,Tue Sep 02 23:51:28 +0000 2025,11,110,15,2025-09-02,100
1963025323848839639,"Just max out all your credit cards and make the minimum payment each month for 5 years, Show these bitcoin bros how its done Golden Diwali Style",TinFormer_News,Tue Sep 02 23:44:43 +0000 2025,0,4,0,2025-09-02,144
1963027219611320584,Bitcoin is fueling real-world growth. 🚀 Kiwi businesses: want to start accepting Bitcoin? Connect with @lightningpaynz ⚡🇳🇿,jamesviggy,Tue Sep 02 23:52:15 +0000 2025,3,25,1,2025-09-02,122
1963024893194203568,NEW: $25 Billion prime brokerage firm Clear Street reconfirms a Buy rating on #Bitcoin treasury miner Hut 8 ($HUT) Price target: $33 (up from $23) 🔥,BTCtreasuries,Tue Sep 02 23:43:00 +0000 2025,4,24,3,2025-09-02,148
1963026720581419244,"Bitcoin closed red again in August, marking its 4th consecutive year of a bearish August. The seasonal correction trend persists, and market sentiment has turned more cautious. Looking at historical performance, September has always been Bitcoin’s weakest month of the year, with",MiraVukova,Tue Sep 02 23:50:16 +0000 2025,0,3,1,2025-09-02,279
1963028829703720981,"Good night CT In the early days of Bitcoin, very few people believed in its future. Most dismissed it as internet money or a passing trend but in 2011 a 12year old boy named Erik Finman saw something different. With $1,000 gifted to him by his grandmother Erik decided to take a",pendingbilonia,Tue Sep 02 23:58:38 +0000 2025,1,13,5,2025-09-02,278
1963027807425949901,"JUST IN: 🇺🇸 Max Keiser warns U.S. debt crisis will send Bitcoin above $2,000,000.",boomerbust_,Tue Sep 02 23:54:35 +0000 2025,0,2,0,2025-09-02,81
1963026118585548896,"Ever wondered how to get Bitcoin yield on Solana without the usual bridge hassles? LBTC might be worth a look if you are into DeFi. LBTC from @lombard_finance turns Bitcoin into a productive asset on Solana by staking it for yield. Buyers earn passive returns, sellers tap",IsakXBT,Tue Sep 02 23:47:52 +0000 2025,0,22,19,2025-09-02,272
1963028141586206783,Shiny Heffers survives another Crypto crash! #shinyheffers #crypto #bitcoin #memcoin #halo,Shinyheffers,Tue Sep 02 23:55:54 +0000 2025,2,3,1,2025-09-02,90
1963027950321992104,"New #XRPL environmental data shows the entire network has a carbon footprint equal to ONE transatlantic flight. Meanwhile, a single XRP transaction uses energy equivalent to running an LED light for 1 millisecond. Compare that to Bitcoin's massive footprint. The future of",RipEffectNews,Tue Sep 02 23:55:09 +0000 2025,9,37,0,2025-09-02,272
1963028211136094504,my real name is Macon Gelstone,HodlTarzan,Tue Sep 02 23:56:11 +0000 2025,0,5,2,2025-09-02,30
1963025580632273395,"MetaSo Chat isn’t just another messaging app — it’s the Bitcoin Telegram 🟧 🔥 Every message you send is on-chain, permanent, and unstoppable, powered by MVC + MetaID. Be early, test beta:",MetaID_PGD,Tue Sep 02 23:45:44 +0000 2025,12,16,2,2025-09-02,186
1963027528735719835,"""We aim to be the ambassadors of Bitcoin in this territory."" Join Lynne Bairstow and @isra_munoz as they chat with Santiago Varela and Max Schatz from Casa de Satoshi. Listen now:",uncleJim21,Tue Sep 02 23:53:28 +0000 2025,0,0,0,2025-09-02,179
1963027781073215680,The meteoric rise of #GOLD is not sustainable It could do what #BITCOIN did after it rose to an all-time high! $GLD $XAUUSD,Krypto_Moons,Tue Sep 02 23:54:28 +0000 2025,0,1,0,2025-09-02,123
1963026084573700485,Do you think this can take me out of the trenches @boundless_xyz is the new bitcoin mining,Oxvague_,Tue Sep 02 23:47:44 +0000 2025,0,5,1,2025-09-02,90
1963027856759652566,"Post BitcoinAsia reflections. - Bitcoin adoption is driven by corporate & institutional demand - Whoever figures out how to combine TradFi with BitcoinFi wins big time - LP token yield is over, people are looking for real BTC yield - Miners are underutilized in BitcoinFi",MarvinDefi,Tue Sep 02 23:54:47 +0000 2025,0,8,1,2025-09-02,271
1963025827832201727,"JUST IN: 🟠 Global M2 is at an ALL TIME HIGH 💥 Historically, #Bitcoin price follows. $BTC #crypto",ImCryptOpus,Tue Sep 02 23:46:43 +0000 2025,0,2,1,2025-09-02,96
1963026151187874012,Lock in or clock in? 💪 It is always fun being a part of building and growing the community! Let's connect and explore the imaginations 📷 *We work with Hand Drawn 2D animations and Illustrations* #BTC $SOL #spx6900 #memecoin #animation #web3 #cryptocurrency #Bitcoin #NFT,comicationslab,Tue Sep 02 23:48:00 +0000 2025,0,3,2,2025-09-02,270
1963028471904706875,"Over the past year of hosting the @BuildwBitcoin podcast, @isra_munoz and I have seen clear trends and exciting ways in which operating with a Bitcoin standard can change the very nature of startup funding and reinvent Venture Capital. And these are very positive changes:",lynnerae,Tue Sep 02 23:57:13 +0000 2025,2,10,2,2025-09-02,272
1963028981382365311,"bitcoin still needs to clear mid VAMP here, but it's looking constructive",themarketradar,Tue Sep 02 23:59:15 +0000 2025,0,7,1,2025-09-02,73
1963029091042656266,"🚨 #Bitcoin in a minor correction… should you worry? Will it hold above 100K and keep the bullish trend alive? Meanwhile, $ETH keeps surprising with fresh highs. 📽️ Full breakdown👇",blackbullforex,Tue Sep 02 23:59:41 +0000 2025,0,3,2,2025-09-02,179
1963026426380386732,"So I'm def going thru this Seeker Eco system, I said let me look at go mining. Somebody make it make sense 🤔 so I pay 26$ to make 10$ of Bitcoin? Why wouldn't I just buy 26$ worth of Bitcoin? 🥸 #Crypto #Depin",CryptoTurnUp,Tue Sep 02 23:49:05 +0000 2025,0,1,0,2025-09-02,208
1963025873751175668,"Strategy recently bought 4,048 Bitcoin for $449.3M at an average price of $110,981 per coin, bringing its total to 636,505 BTC valued at nearly $47B. Using equity sales, they fund steady Bitcoin purchases via OTC trades, minimizing market impact. This disciplined approach",Famacrypt,Tue Sep 02 23:46:54 +0000 2025,0,4,2,2025-09-02,272
1963029090140844484,@FOMO21shop Personal favorites I’ve gotten: -That lightning was litecoin. (Took awhile to unwind that one) -That they invest in “that stock” (talking about owning Bitcoin) -What if Satoshi takes all the Bitcoin back? -What if someone shuts off the internet? -Won’t Bitcoin give me a,ErinEMalone,Tue Sep 02 23:59:41 +0000 2025,2,10,1,2025-09-02,282
1963025791546982427,"Today’s pod in 30 min: 🏯 Metaplanet swinging $3.7B 💰 Saylor dropping $449M 📊 Suits caging 7% supply 🚀 $1M Bitcoin staring you in the face But yeah… keep holding your “safe” bonds, Karen 🤡",bitcoinnip,Tue Sep 02 23:46:34 +0000 2025,8,12,0,2025-09-02,187
1963026394960613736,"Just On-Chain, Bitcoin-Native Art",missi_scott,Tue Sep 02 23:48:58 +0000 2025,2,7,0,2025-09-02,33
1963025452169408792,Finally got my answer — Zohran Mamdani pulled more votes than any NYC Dem mayoral candidate since 1989 📊🗳️ So how did it happen if “no one supports him”? 🤔 Powered by #HOSANNA ✝️ #Coi 🌐 #Bitcoin ₿ #Ethereum #DeFi 🌊 #HODL 🚀 #CryptoNews 👥 #Ai #Mamdani #Mayor #ELECTIONS2025,HosannaCoin,Tue Sep 02 23:45:13 +0000 2025,0,1,1,2025-09-02,271
1963024969492811821,Bitcoin is Retesting the 8 year trend line Lets bounce ⚡️🌪 #Bitcoin #Trump #CryptoNews #memecoin #Trending #BullRun #BreakingNews #Fintech #Web3,FXCRYPTOMASTER,Tue Sep 02 23:43:18 +0000 2025,0,2,0,2025-09-02,144
1963026091469373538,You can also listen to this on: - Fountain: - Rumble: - our Website: - YouTube: - Apple: - Spotify:,BuildwBitcoin,Tue Sep 02 23:47:46 +0000 2025,0,1,0,2025-09-02,99
1963025435626733568,If Bitcoin is digital gold then Creator Capital Markets is liquid attention.,JacobCubby,Tue Sep 02 23:45:09 +0000 2025,0,5,1,2025-09-02,76
1963027547974746574,"@ESPNFC A 7/9 pairing sounds pretty strong! We're partial to a different kind of powerful duo around here, though. Think purple and possibility. 💜",purple_bitcoin_,Tue Sep 02 23:53:33 +0000 2025,0,2,0,2025-09-02,146
1963027843241185296,10 Best ways to find 100x Meme Coins on SUI – Try NOW! (September 2025) #btc #bitcoin #crypto #cryptonews,CryptoNewsMag,Tue Sep 02 23:54:43 +0000 2025,0,0,0,2025-09-02,105
1963028775530332451,"Good thread. Islamic finance feels like it’s on life support. Whatever spark it once had 30 years ago is basically gone. I bet most Muslims deep down already accept that the industry has failed. Of course, Bitcoin fixes this.",MBitcoiner,Tue Sep 02 23:58:26 +0000 2025,2,29,3,2025-09-02,225
1963027957032849665,Me dreaming about finding old Bitcoin wallet I forgot about 15 years ago 🫢,Calidumhoney,Tue Sep 02 23:55:10 +0000 2025,0,2,0,2025-09-02,74
1963029029734261235,"@CryptoDona7 It's a journey to see past the noise, that's for sure. True belief comes from solid foundations, not fleeting narratives. Good to have you on the discerning side! 💜",purple_bitcoin_,Tue Sep 02 23:59:26 +0000 2025,0,6,0,2025-09-02,177
1963028574811680925,"🛑We’ve moved from a low-inflation world (2000–2020) to a new regime where #inflation is structural, persistent, and bottoms at higher levels. 2000–2020 = Dormant inflation (1–2%) 2021 spike (7–9%) 2023–2024 cooling (3–4%) 2025+ “new floor” (3%+) → vs. old floor (1%) 🔄 Shift",BitcoinOnwards,Tue Sep 02 23:57:38 +0000 2025,0,0,0,2025-09-02,274
1963028201464090805,"JOLTS Job Openings (Jul) • Consensus: 7.39M • Previous: 7.437M • Actual: Out tomorrow 10:00 AM ET This report gives insight into U.S. labor demand → key for Fed policy & markets. Watch $USD, bonds, and equities, Gold/Silver, Bitcoin/crypto for reaction.",da_sails,Tue Sep 02 23:56:09 +0000 2025,0,1,0,2025-09-02,253
1963026016990851132,🔴🔴🔴 #BTCDOMUSDT - Funding rate above 0.03% FR: 0.0302% 5m: 0.0299% (1.05%) 15m: 0.0282% (7.15%) ------ CP: 3957.732790 5m: 3959.398821 (-0.04%) 15m: 3961.603646 (-0.10%) . $ETH $FARM $Manta #FARTCOIN #Bitcoin #Bnb $Vana $SAGA #ALT Click below 👇,crypto_vicky001,Tue Sep 02 23:47:28 +0000 2025,0,0,0,2025-09-02,244
1963024999444517163,"Upward: Shifting Innovation to the Application Layer Blockchain technology has evolved rapidly—from Bitcoin to Ethereum, Layer 2s, stablecoins, modular designs, and zero-knowledge breakthroughs—making it faster, cheaper, and more programmable. But despite constant",diemsuongltd,Tue Sep 02 23:43:25 +0000 2025,0,4,1,2025-09-02,264
1963022712315773213,Next billion dollar runner.🏴🏴🟠🟠 #stockcoin #bitcoin $troll $sol @trololol_io @stockcoinonsol,Layer1Dog,Tue Sep 02 23:34:20 +0000 2025,0,2,0,2025-09-02,92
1963029046398243202,16X obtained on $GOLD Sweet gains on my privates Midnight printers here Send a dm here 👉 #Solana #Crypto #DOGE #zeudiners #memecoin #Trump #LaborDay2025 #Bitcoin,Ian_onSol,Tue Sep 02 23:59:30 +0000 2025,0,1,0,2025-09-02,161
1963024400623517822,📊 River’s firm data: Businesses are stacking BTC at 4x the mining rate. Demand over supply is the strongest bullish signal Bitcoin holders crave. #Crypto #Bitcoin,VictorB39400,Tue Sep 02 23:41:02 +0000 2025,0,2,0,2025-09-02,162
1963028787463065993,"Bitcoin is like a train - first it crawls, then it moves, and once it picks up speed you can’t stop it. 🚂⚡ #Bitcoin",GlloballCitizen,Tue Sep 02 23:58:28 +0000 2025,0,0,0,2025-09-02,115
1963028551839711564,"$111.201 #BTC - Bitcoin Core - Market Cap ~$2,215B $584 #BCH - Bitcoin Cash - Market Cap ~$12B $25,8 #BSV - Bitcoin SV - Market Cap ~$1B #Bitcoin evolved: BTC, BCH, and BSV - three visions, one legacy.",BitcoinOke,Tue Sep 02 23:57:32 +0000 2025,0,3,0,2025-09-02,201
1963028559410192410,"BOB's Modular Architecture: Scaling Bitcoin for DeFi Without Altering Its Core In BOB's modular setup, Bitcoin can scale effectively without any changes to its core protocol. Rather than cramming everything into a single chain. @build_on_bob project breaks down key functions",seanvikson,Tue Sep 02 23:57:34 +0000 2025,0,3,3,2025-09-02,275
1963028603957842323,@CressonMiningCo I don't drive that conclusion from the bitcoin drama. In fact the conclusion I get is that resisting to change will lower your chances of survival 50 years from now. Kaspa adapts to users needs and asks. Bitcoin simply doesn't.,KaspaSilver,Tue Sep 02 23:57:45 +0000 2025,3,57,2,2025-09-02,244
1963027441737183292,Bitcoin is undermining fiat currency so very fast and the world still doesn’t see it happening.,Shawan4Freedom,Tue Sep 02 23:53:08 +0000 2025,0,2,0,2025-09-02,95
1963023896858525988,Gold is up 3.5x more than the S&P 500 YTD. What do you think Bitcoin is going to do next?,TheBTCTherapist,Tue Sep 02 23:39:02 +0000 2025,136,507,113,2025-09-02,89
1963026050922803219,Can u see this candle 💚 thats the bitcoin candle for this month 🌪⚡️ #Bitcoin #Trump #CryptoNews #memecoin #Trending #BullRun #BreakingNews #Fintech #WEB3,FXCRYPTOMASTER,Tue Sep 02 23:47:36 +0000 2025,0,2,0,2025-09-02,153
1963024941743280333,"@stoolpresidente A great fold requires vision. We've got our eyes on the horizon, and it's looking pretty purple. 💜",purple_bitcoin_,Tue Sep 02 23:43:12 +0000 2025,0,1,0,2025-09-02,115
1963024217122677073,"Coinbase's New Futures Index Tracks Bitcoin, Ethereum—Plus 'Mag 7' Stocks Like Nvidia",TSLAInvestors,Tue Sep 02 23:40:19 +0000 2025,0,1,0,2025-09-02,85
1963026742555050116,"The altcoin season directs investments into Four via GameFi launches, into Sky through a governance transition, and into Bitget Token by leveraging exchange utility. #BITCOIN, #CRYPTOCURRENCY, #ALTCOINS",CryptosGist,Tue Sep 02 23:50:21 +0000 2025,0,3,0,2025-09-02,202
1963028325690994987,"So much of love for H1Bs😀 Its time to send them back, but wait🌮will talk all nonsense & then say ""I love H1Bs"" Waiting when he cancels all H1Bs!!",Super_Crypto,Tue Sep 02 23:56:38 +0000 2025,0,0,0,2025-09-02,145
1963026472848756888,"In 2015, you could earn a whole Bitcoin in just 13 hours of work. Today? It takes 3,800 hours, that’s almost 2 years on a full-time job LOL $BTC isn’t getting easier to earn. It’s getting scarcer.",cryptonick222,Tue Sep 02 23:49:17 +0000 2025,0,8,1,2025-09-02,196
1963028811462631605,Artificial intelligence coin AIXBT coin will rise a lot. Artificial intelligence coins will be very profitable in this bull. ✅🚀💰🚀#Bitcoin #Ethereum #aıxbt #DOGE #XRP #solano #Altcoins #Trump #crypto #HemiNetwork #Epstein #powell #trumpdead #OrmxOMEGAinBANGKOK,wiseBitcoin,Tue Sep 02 23:58:34 +0000 2025,0,3,0,2025-09-02,259
1963024506483839121,Everyone on this app: I promise Bitcoin isn’t correlated to Mag7 risk on assets. Coinbase:,HodlMagoo,Tue Sep 02 23:41:28 +0000 2025,6,71,16,2025-09-02,90
1963028212679688305,"Turning Bitcoin from a passive store of value into an active DeFi powerhouse is the game-changer we’ve been waiting for. With @build_on_bob unlocking cross-chain lending, swaps & yield, $BOB isn’t just expanding Bitcoin’s utility, it’s rewriting the rules of decentralized finance",VICKYMMG1,Tue Sep 02 23:56:11 +0000 2025,3,4,0,2025-09-02,280
1963026998386983343,"The BTC Faucet In 2010, the Bitcoin Faucet website gave away 5 bitcoins to every visitor who passed a captcha. They were literally giving bitcoin away for free",Brosef323,Tue Sep 02 23:51:22 +0000 2025,0,0,0,2025-09-02,159
1963028658999709969,"🚨‘The Data is a Lie’: Analyst Who Called 3 Crashes Reveals What's Really Happening $BTC($111,114.04) - #BITCOIN",FerozAliAbbasi,Tue Sep 02 23:57:58 +0000 2025,0,0,0,2025-09-02,111
1963024391555711264,Bitcoin is 'We The People' saying: We're done playing your money game. We're all playing by the same rules now.,dchersh,Tue Sep 02 23:41:00 +0000 2025,0,18,0,2025-09-02,111
1963027184676962615,Coinbase Launching First Multi-Asset Futures Tied to Mag7 and Crypto ETFs,MetatronInc,Tue Sep 02 23:52:06 +0000 2025,0,1,1,2025-09-02,73
1963026336181534793,ABC Africa Bitcoin conference ABCD Africa Bitcoin conference diaspora ABCDE Africa Bitcoin conference diaspora exclusive ABCDEFG Africa Bitcoin conference dedicated especially for girls E.t.c,apataj2,Tue Sep 02 23:48:44 +0000 2025,0,0,0,2025-09-02,191
1963024769835569362,🔴🔴 #AVAAIUSDT - Funding rate above 0.02% FR: 0.0203% 5m: 0.0187% (8.15%) 15m: 0.0117% (73.20%) ------ CP: 0.023349 5m: 0.023334 (0.06%) 15m: 0.023358 (-0.04%) . $ETH $FARM $Manta #FARTCOIN #Bitcoin #Bnb $Vana $SAGA #ALT $PENGU $GRASS Click below 👇,crypto_vicky001,Tue Sep 02 23:42:31 +0000 2025,0,0,0,2025-09-02,247
1963027093718990866,Bitcoin ETF Daily Flow - US$ GBTC (Grayscale): 0 million For all the data and disclaimers visit:,FarsideUK,Tue Sep 02 23:51:45 +0000 2025,0,5,2,2025-09-02,96
1963028021654257699,Bitcoin ETF Daily Flow - US$ VanEck: 4.7 million 5% of profits from this product go to Bitcoin developers For all the data and disclaimers visit:,FarsideUK,Tue Sep 02 23:55:26 +0000 2025,0,14,1,2025-09-02,145
1963026337066844468,Fartcoin following the Bitcoin playbook .69 to $10.,baker2g__,Tue Sep 02 23:48:44 +0000 2025,3,105,5,2025-09-02,51
1963027379070083080,"Ether Machine secures $654 million in ETH through private funding in preparation for its Nasdaq listing, with 150,000 ETH ready for transfer. @Bitcoin, @Ethereum, @Binance, @solana #BITCOIN, #CRYPTOCURRENCY, #ALTCOINS",CryptosGist,Tue Sep 02 23:52:53 +0000 2025,0,4,0,2025-09-02,217
1963024272122904672,"@fomomofosol @a1lon9 Lol mode What could be a better choice than the first ever memecoin supporting earlier Bitcoin miners since 2011? Before Doge. Before Pepe. Before every other memecoin. This is pure culture, deepest lore& infinite memetics. #LOLCOIN",LickMyAlgorithm,Tue Sep 02 23:40:32 +0000 2025,6,9,1,2025-09-02,253
1963022977714245784,"MicroStrategy buying Bitcoin was the spark that redefined corporate treasuries. Now @Injective has its moment. Pineapple Financial ( $PAPL ), a U.S. fintech platform, has announced a $100M Injective treasury. This marks the first publicly traded company to dedicate a treasury",wavymaverick,Tue Sep 02 23:35:23 +0000 2025,38,362,27,2025-09-02,276
1963027805513613407,Gold is up 3.5x more than the S&P 500 YTD. What do you think Bitcoin is going to do next??,CadaCrypt0,Tue Sep 02 23:54:34 +0000 2025,0,0,0,2025-09-02,90
1963023481014001765,"@BSCNews @binance Five new ones, exciting! Wonder if any of them have that certain... *purple* glow? Just curious. 🔮",purple_bitcoin_,Tue Sep 02 23:37:23 +0000 2025,0,2,0,2025-09-02,116
1963024632820466058,"This September, let ‘S’ stand for serenity as much as success, for self care as much as striving. May it be a month of fresh beginnings that bring not stress, but stability, security, and a quiet kind of joy. #TuesdayMotivaton #tuesdayvibe #September2025 #Bitcoin #BREAKING",AllisonGavinfx,Tue Sep 02 23:41:58 +0000 2025,0,0,0,2025-09-02,273
1963027985621254440,Bitcoin Long Term EMA.,kametool,Tue Sep 02 23:55:17 +0000 2025,0,0,0,2025-09-02,22
1963023382816972839,Wall Street once laughed at Bitcoin. Now they’re underwriting its yield.,Bagman365,Tue Sep 02 23:37:00 +0000 2025,0,2,0,2025-09-02,72
1963028669968089313,"Gold was hard money, but governments corrupted it. Bitcoin restores monetary discipline without needing trust.",escapev_pod,Tue Sep 02 23:58:00 +0000 2025,0,2,0,2025-09-02,110
1963024568383123733,I dont understand how people can see bitcoin hit 120k and then say pack it up lets go home its never going higher. Its gonna hit 200k then 300k then 400k all the way up to millions per coin. Its limited supply makes it one of the rarest things on earth. It isnt going to hit a,Rally__vincent,Tue Sep 02 23:41:42 +0000 2025,0,17,3,2025-09-02,276
1963027512470208598,"You can buy $ELA You can merge mine $ELA with bitcoin You can earn $ELA by staking it You can mint BTCD with BTC and ELA Just accumulate more ELA before it reaches 100$ or more Long ELA, Long BTC! Only $ELA price matters!",Tyrowhenrich,Tue Sep 02 23:53:24 +0000 2025,3,25,3,2025-09-02,221
1963028055317745693,The cryptocurrency world recently witnessed a truly remarkable event: the successful Venus Protocol recovery. #BNBChain #cryptosecurity #fundrecovery #PhishingAttack #VenusProtocol,ItsBitcoinWorld,Tue Sep 02 23:55:34 +0000 2025,0,1,1,2025-09-02,180
1963027750425399380,"When @KaiCenat hits the gym, even Big Back Bitcoin ($BBBTC) starts deadlifting burritos like it's bench-pressing baguettes! Keep stacking those gains and crypto carbs till we reach that spicy taco moon. 🍕💪🚀",BigBackBitcoin,Tue Sep 02 23:54:21 +0000 2025,0,0,0,2025-09-02,206
1963026231840145866,"Ukraine could potentially be losing over $10 billion in misappropriated funds and uncollected tax revenue because of inadequate regulation in its #cryptocurrency industry. #BITCOIN, #ALTCOINS",CryptosGist,Tue Sep 02 23:48:19 +0000 2025,0,0,0,2025-09-02,191
1963026530696888816,you knots and core runners are simply not on my level. I run The Real Bitcoin node. Anything else is for HEATHENS.,justh0dl,Tue Sep 02 23:49:30 +0000 2025,0,2,1,2025-09-02,114
1963027793924493596,And now we wait… I just need bitcoin price to make a large candle up or down so I can test out this new trading feature.,Gladvillain,Tue Sep 02 23:54:32 +0000 2025,0,2,0,2025-09-02,120
1963027981166948762,🟠 #Bitcoin #Facts 🟠 Bitcoin spot market signals potential recovery rally...👀😱 👇 Here are some morming facts on this #Crypto #CryptoMarket #cryptocurrencies #BTC,AllFactsCrypto,Tue Sep 02 23:55:16 +0000 2025,0,1,1,2025-09-02,160
1963025230147752277,🔴🔴🔴 #MYXUSDT - Funding rate above 0.03% FR: 0.0327% 5m: 0.0298% (9.58%) 15m: 0.0304% (7.40%) ------ CP: 1.201000 5m: 1.196500 (0.38%) 15m: 1.198956 (0.17%) . $ETH $FARM $Manta #FARTCOIN #Bitcoin #Bnb $Vana $SAGA #ALT $PENGU $GRASS #BTC Click below 👇,crypto_vicky001,Tue Sep 02 23:44:20 +0000 2025,0,0,0,2025-09-02,249
1963028470885449767,Next anyone wanna go out ⁦@wallstreetbets⁩ ⁦@PrimeVideo⁩,Allaboutbit,Tue Sep 02 23:57:13 +0000 2025,1,0,1,2025-09-02,56
1963027098139828691,Bitcoin ETF Daily Flow - US$ BTC (Grayscale): 9.3 million For all the data and disclaimers visit:,FarsideUK,Tue Sep 02 23:51:46 +0000 2025,0,14,2,2025-09-02,97
1963028799991238831,Massive pump with massive profit obtained from my private 10x profit from my alpha call on $EV2 Private tg frens eating good CA> 9NG3mUYEzCFqPwuLvhYabnvhGiZSZN9VgurcfVCFpump #solana #memecoin #degen #cryptotrading #Bitcoin,Degeninvestor11,Tue Sep 02 23:58:31 +0000 2025,0,1,0,2025-09-02,222
1963028877778796604,Bitcoin geeks are great. Bitcoin nerds suck.,GHOSTawyeeBOB,Tue Sep 02 23:58:50 +0000 2025,0,15,2,2025-09-02,44
